{
  "$schema": "http://json-schema.org/draft-07/schema#",
  "$id": "https://nguyenduchoa.com/schemas/nano-flow-manifest-1.0.json",
  "title": "Nano Flow Manifest",
  "description": "Shared contract between Storyboard AI (planner) and AutoFlow Reel extension (operator). Identical copy lives in both repos under docs/nano-flow-pipeline/. See DESIGN.md.",
  "type": "object",
  "required": ["manifest_version", "generator", "project", "assets", "shots"],
  "additionalProperties": false,
  "properties": {
    "manifest_version": { "type": "string", "const": "1.0" },
    "generator": { "type": "string", "description": "e.g. storyboard-ai" },
    "generated_at": { "type": "string", "format": "date-time" },

    "project": {
      "type": "object",
      "required": ["title"],
      "additionalProperties": true,
      "properties": {
        "project_id": { "type": "string" },
        "title": { "type": "string" },
        "aspect_ratio": { "type": "string", "enum": ["16:9", "9:16", "1:1"] },
        "board_aspect_ratio": { "const": "16:9", "description": "Storyboard board/sheet format. Always landscape and independent from final video aspect_ratio." },
        "dialogue_language": { "type": "string" },
        "production_prompt_language": { "type": "string", "description": "Language for machine-facing camera, action, environment and continuity instructions; independent from dialogue/UI locale." },
        "total_duration_seconds": { "type": "number" },
        "thumbnail_title": { "type": "string" },
        "thumbnail_aspect_ratio": { "type": "string", "enum": ["16:9", "9:16"], "description": "Thumbnail delivery format; independent from the video aspect ratio." },
        "social_posts": {
          "type": "object",
          "description": "Reuses the existing Storyboard SocialPosts shape verbatim (tiktok / youtube_shorts / facebook_reel)."
        },
        "character_style": {
          "type": "object",
          "required": ["id", "prompt"],
          "additionalProperties": false,
          "description": "Exact character and environment visual-medium lock selected in Storyboard; repeated inside image/video prompts for consumers that ignore project metadata.",
          "properties": {
            "id": { "type": "string" },
            "prompt": { "type": "string" }
          }
        }
      }
    },

    "assets": {
      "type": "object",
      "description": "Reference images declared once per project. Each shot references entries by id. image=null means the slot is declared but the user attaches the real image on the extension side.",
      "additionalProperties": false,
      "properties": {
        "characters":   { "type": "array", "items": { "$ref": "#/definitions/asset" } },
        "environments": { "type": "array", "items": { "$ref": "#/definitions/asset" } },
        "products":     { "type": "array", "items": { "$ref": "#/definitions/asset" } }
      }
    },

    "shots": {
      "type": "array",
      "minItems": 1,
      "items": { "$ref": "#/definitions/shot" }
    },
    "production_state": {
      "type": "object",
      "description": "Additive canonical Production State. Legacy consumers may ignore it; prompt compilers use it as script-derived state authority.",
      "required": ["version", "registry", "shots", "boundaries", "findings"],
      "additionalProperties": true,
      "properties": {
        "version": { "type": "string" },
        "registry": { "type": "array" },
        "shots": { "type": "array" },
        "boundaries": { "type": "array" },
        "findings": { "type": "array" }
      }
    },
    "export_qa": {
      "type": "object",
      "description": "Non-blocking export QA snapshot. A valid manifest may be exported with warnings; consumers may ignore this additive field.",
      "required": ["status", "counts", "findings"],
      "additionalProperties": false,
      "properties": {
        "status": { "enum": ["clean", "exported_with_warnings"] },
        "counts": {
          "type": "object",
          "required": ["critical", "high", "medium", "total"],
          "additionalProperties": false,
          "properties": {
            "critical": { "type": "integer", "minimum": 0 },
            "high": { "type": "integer", "minimum": 0 },
            "medium": { "type": "integer", "minimum": 0 },
            "total": { "type": "integer", "minimum": 0 }
          }
        },
        "findings": { "type": "array" }
      }
    }
  },

  "definitions": {
    "asset": {
      "type": "object",
      "required": ["id", "name"],
      "additionalProperties": false,
      "properties": {
        "id":       { "type": "string", "description": "Stable id referenced by shots, e.g. char_lan" },
        "name":     { "type": "string", "description": "Human label, e.g. Lan" },
        "image":    { "type": ["string", "null"], "description": "data: URI or null (user attaches later in extension)" },
        "required": { "type": "boolean", "default": false },
        "wardrobe": { "type": "string", "description": "Characters only — the story-locked outfit. The extension builds one full-body wardrobe sheet (identity photo + this outfit) and reuses it as the reference for every keyframe so face AND clothes stay identical. Empty ⇒ extension derives an outfit from the scene." },
        "location_views": { "type": "array", "items": { "$ref": "#/definitions/locationView" }, "description": "Legacy environments-only A2 pair. Kept for compatibility." },
        "location_sheet_prompt": { "type": "string", "description": "Preferred environments-only A2 contract: generate ONE 16:9 sheet containing exactly two clearly distinct, character-free angles of the same set." }
      }
    },

    "locationView": {
      "type": "object",
      "description": "A2 — one character-free establishing view of a location (see asset.location_views).",
      "required": ["angle", "prompt"],
      "additionalProperties": false,
      "properties": {
        "angle":  { "type": "string", "description": "\"wide\" (full establishing) | \"alt\" (second angle of the SAME place)." },
        "prompt": { "type": "string", "description": "Prompt (100% Storyboard) to generate this EMPTY location image — no people, no product; same set, materials, furniture and lighting as its scenes." }
      }
    },

    "refSelector": {
      "type": "object",
      "description": "Which declared assets to attach at a given step.",
      "additionalProperties": false,
      "properties": {
        "characters":   { "type": "array", "items": { "type": "string" } },
        "environments": { "type": "array", "items": { "type": "string" } },
        "products":     { "type": "array", "items": { "type": "string" } }
      }
    },

    "videoRefSelector": {
      "type": "object",
      "additionalProperties": false,
      "properties": {
        "use_generated_storyboard": {
          "type": "boolean",
          "default": true,
          "description": "Use the Nano-Banana-generated image from step A as the video FIRST FRAME."
        },
        "characters":   { "type": "array", "items": { "type": "string" } },
        "environments": { "type": "array", "items": { "type": "string" }, "description": "Default empty — background already baked into the keyframe (see DESIGN.md §6)." },
        "products":     { "type": "array", "items": { "type": "string" }, "description": "Default empty — enable only when exact logo/label fidelity is needed." }
      }
    },

    "beat": {
      "type": "object",
      "additionalProperties": true,
      "properties": {
        "beat":   { "type": "string" },
        "camera": { "type": "string" }
      }
    },

    "scene": {
      "type": "object",
      "description": "Schema 4.1 — one SCENE inside a shot, generated as its own Nano Banana image.",
      "required": ["scene_no", "action", "image_prompt"],
      "additionalProperties": false,
      "properties": {
        "scene_no":     { "type": "integer", "minimum": 1, "description": "1-based order within the shot." },
        "camera":       { "type": "string", "description": "Camera framing for this scene, e.g. \"[CLOSE]\"." },
        "action":       { "type": "string", "description": "The scripted action/moment this scene depicts." },
        "image_prompt": { "type": "string", "description": "Prompt (100% Storyboard) to generate THIS scene's image — shot's locked context at this scene's moment." },
        "image_refs":   { "$ref": "#/definitions/refSelector", "description": "Assets to attach for this scene's image gen." },
        "location_id":  { "type": "string", "description": "Environment asset id for this scene (a shot may span locations)." },
        "transition_from_prev": { "type": "string", "enum": ["opening", "continuous", "scene_cut", "location_cut", "time_jump", "parallel_intercut", "match_cut", "montage", "flashback", "dream", "symbolic"], "description": "How this scene continues from the previous scene (or prior shot for scene 1)." },
        "dialogue":     { "type": ["string", "null"] }
      }
    },

    "shot": {
      "type": "object",
      "required": ["shot_id", "index", "storyboard_name", "storyboard_prompt", "video_prompt"],
      "additionalProperties": false,
      "properties": {
        "shot_id":         { "type": "string", "description": "e.g. SHOT_001" },
        "index":           { "type": "integer", "minimum": 1 },
        "storyboard_name": { "type": "string", "description": "Name given to the Nano Banana image, ordered." },
        "duration_seconds":{ "type": "number", "default": 10 },
        "marketing_role":  { "type": "string", "enum": ["hook", "problem", "solution", "body", "cta"] },
        "continuity_mode": { "type": "string", "enum": ["opening", "continuous", "scene_cut", "location_cut", "time_jump", "parallel_intercut", "match_cut", "montage", "flashback", "dream", "symbolic"], "description": "Schema 4.0 — continuity decision for the boundary entering this shot." },
        "location_id":     { "type": "string", "description": "Environment asset id this shot's scenes default to (per-location memory/background ref)." },

        "storyboard_prompt": { "type": "string", "description": "STEP A — single-image FALLBACK keyframe prompt. When scenes[] is present the extension renders per-scene images instead; this is kept for consumers that ignore scenes." },
        "scenes": { "type": "array", "items": { "$ref": "#/definitions/scene" }, "description": "Schema 4.1 — ordered SCENES of this shot, one generated image each (built from beats). Replaces the single-keyframe collapse; a shot may span locations." },
        "end_storyboard_prompt": { "type": "string", "description": "STEP A2 (optional) — prompt for the END keyframe of a transform shot. When present, the video uses start_end_frame mode: Veo interpolates start→end. Omit for a normal single-keyframe shot." },
        "image_refs":        { "$ref": "#/definitions/refSelector", "description": "STEP A — which assets feed the image generation (shared by start + end keyframes)." },

        "video_prompt":         { "type": ["string", "object"], "description": "STEP B — full Veo prompt (written 100% by Storyboard). Either flat prose (string) or the structured Veo clip JSON (object); the extension stringifies objects into Flow's prompt box." },
        "characters_in_scene":  { "type": "array", "items": { "type": "string" }, "description": "Exact character names on screen (mirrors Storyboard VideoSegment.characters_in_scene)." },
        "video_refs":           { "$ref": "#/definitions/videoRefSelector", "description": "STEP B — which refs to attach when generating the video." },

        "dialogue": { "type": ["string", "null"] },
        "voice":    { "type": ["string", "null"], "description": "Maps to the extension voice list (auto/achernar/achird/...)." },
        "beats":    { "type": "array", "items": { "$ref": "#/definitions/beat" } },
        "wardrobe_change": { "type": ["object", "null"], "additionalProperties": { "type": "string" }, "description": "A visibly motivated change of clothes starting at this shot: { \"CharacterName\": \"new outfit\" }. The extension regenerates that character's full-body wardrobe sheet with the new outfit and uses it from this shot onward. Omit/null when unchanged." },
        "state_authority": {
          "type": "object",
          "description": "Canonical script/state contract embedded into both prompts. Authority flows script -> Production State -> video prompt -> storyboard board; never in reverse.",
          "required": ["production_shot_id", "authority_fingerprint", "authority_order", "script_contract", "start_snapshot", "end_snapshot", "camera_state", "lighting_state", "actions", "findings"],
          "additionalProperties": false,
          "properties": {
            "production_shot_id": { "type": "string" },
            "authority_fingerprint": { "type": "string" },
            "authority_order": {
              "type": "array",
              "items": { "type": "string" },
              "minItems": 4,
              "maxItems": 4
            },
            "script_contract": { "type": "object", "additionalProperties": true },
            "start_snapshot": { "type": "object", "additionalProperties": true },
            "end_snapshot": { "type": "object", "additionalProperties": true },
            "spatial_graph": { "type": ["object", "null"], "additionalProperties": true },
            "camera_state": { "type": "object", "additionalProperties": true },
            "lighting_state": { "type": "object", "additionalProperties": true },
            "actions": { "type": "array" },
            "findings": { "type": "array" }
          }
        }
      }
    }
  }
}
